{
  "$schema": "https://json-schema.org/draft/2020-12/schema",
  "$id": "https://vllm-apple.local/schemas/runtime/qualification-report-v1.schema.json",
  "title": "Real-model qualification report v1",
  "type": "object",
  "required": ["schema_version", "model", "backend", "load_seconds", "shutdown_clean", "promotion_probe", "soak", "context_reevaluation", "passed"],
  "properties": {
    "schema_version": {"const": 1},
    "model": {"type": "string", "minLength": 1},
    "backend": {"enum": ["vllm_metal", "mlx_lm"]},
    "backend_versions": {
      "type": ["object", "null"],
      "properties": {
        "vllm": {"type": ["string", "null"], "minLength": 1, "maxLength": 128},
        "vllm_metal": {"type": ["string", "null"], "minLength": 1, "maxLength": 128},
        "transformers": {"type": ["string", "null"], "minLength": 1, "maxLength": 128},
        "mlx_lm": {"type": ["string", "null"], "minLength": 1, "maxLength": 128}
      },
      "additionalProperties": false
    },
    "requested_modes": {
      "type": "array",
      "minItems": 1,
      "maxItems": 4,
      "items": {"enum": ["text", "vision", "mtp", "yarn"]}
    },
    "load_seconds": {"type": "number", "minimum": 0},
    "shutdown_clean": {"type": "boolean"},
    "promotion_probe": {"type": ["object", "null"]},
    "phase_profile": {"type": ["object", "null"]},
    "model_memory_fit": {
      "type": ["object", "null"],
      "properties": {
        "artifact_bytes": {"type": "integer", "minimum": 0},
        "estimated_resident_bytes": {"type": "integer", "minimum": 0},
        "hard_ceiling_bytes": {"type": "integer", "minimum": 0},
        "context_tokens": {"type": "integer", "minimum": 1},
        "fits": {"type": "boolean"}
      },
      "required": ["artifact_bytes", "estimated_resident_bytes", "hard_ceiling_bytes", "context_tokens", "fits"],
      "additionalProperties": false
    },
    "quality_smoke": {"type": ["object", "null"]},
    "soak": {"type": ["object", "null"]},
    "context_reevaluation": {
      "type": "object",
      "required": ["enabled", "status", "configured_context_tokens", "effective_context_tokens", "capacity_context_tokens", "kv_capacity_bytes", "kv_bytes_per_token", "weights_bytes", "source", "reevaluations", "passed"],
      "properties": {
        "enabled": {"type": "boolean"},
        "status": {"enum": ["unavailable", "sufficient", "reduced"]},
        "configured_context_tokens": {"type": ["integer", "null"], "minimum": 1},
        "effective_context_tokens": {"type": ["integer", "null"], "minimum": 0},
        "capacity_context_tokens": {"type": ["integer", "null"], "minimum": 0},
        "kv_capacity_bytes": {"type": ["integer", "null"], "minimum": 0},
        "kv_bytes_per_token": {"type": ["integer", "null"], "minimum": 1},
        "weights_bytes": {"type": ["integer", "null"], "minimum": 0},
        "source": {"type": ["string", "null"]},
        "reevaluations": {"type": "integer", "minimum": 0},
        "passed": {"type": "boolean"}
      },
      "additionalProperties": false
    },
    "passed": {"type": "boolean"},
    "architecture_evidence": {
      "type": "object",
      "additionalProperties": false,
      "required": [
        "schema_version",
        "scope",
        "created_at",
        "identity",
        "context_tokens",
        "concurrency",
        "report_sha256"
      ],
      "properties": {
        "schema_version": {
          "const": 1
        },
        "scope": {
          "const": "text_smoke_30min"
        },
        "created_at": {
          "type": "number",
          "minimum": 0
        },
        "identity": {
          "type": "object",
          "additionalProperties": false,
          "required": [
            "config_sha256",
            "model_root_sha256",
            "backend_sha256",
            "environment_sha256",
            "hardware_sha256",
            "runtime_sha256",
            "backend"
          ],
          "properties": {
            "config_sha256": {
              "type": "string",
              "minLength": 64,
              "maxLength": 64
            },
            "model_root_sha256": {
              "type": "string",
              "minLength": 64,
              "maxLength": 64
            },
            "backend_sha256": {
              "type": "string",
              "minLength": 64,
              "maxLength": 64
            },
            "environment_sha256": {
              "type": "string",
              "minLength": 64,
              "maxLength": 64
            },
            "hardware_sha256": {
              "type": "string",
              "minLength": 64,
              "maxLength": 64
            },
            "runtime_sha256": {
              "type": "string",
              "minLength": 64,
              "maxLength": 64
            },
            "backend": {
              "enum": [
                "mlx_lm",
                "vllm_metal"
              ]
            }
          }
        },
        "context_tokens": {
          "type": "integer",
          "minimum": 1,
          "maximum": 16777216
        },
        "concurrency": {
          "type": "integer",
          "minimum": 1,
          "maximum": 256
        },
        "report_sha256": {
          "type": "string",
          "minLength": 64,
          "maxLength": 64
        }
      }
    },
    "qualification_limits": {
      "type": "object",
      "additionalProperties": false,
      "required": [
        "context_tokens",
        "concurrency"
      ],
      "properties": {
        "context_tokens": {
          "type": "integer",
          "minimum": 1,
          "maximum": 16777216
        },
        "concurrency": {
          "type": "integer",
          "minimum": 1,
          "maximum": 256
        }
      }
    }
  },
  "additionalProperties": false
}
